ID,Name,Age,Gender,Country,Salary,Education,Experience,Skills
1,Rachel Sanford,56,Female,United Arab Emirates,124998,PhD,7,"business, last, however, mission"
2,Elizabeth Vega,57,Female,Guam,58899,Bachelors,0,"land, look, increase, product"
3,Morgan Evans,27,Female,Oman,84624,PhD,5,"likely, event, wall, however"
4,Luke Rasmussen,41,Female,Slovakia (Slovak Republic),133704,Masters,8,"list, business, hot, record"
5,Michael Ruiz,39,Female,French Polynesia,116018,Bachelors,3,"expect, article, successful, hot"
6,Steven Tyler,47,Female,Fiji,86449,PhD,8,"report, day, option, really"
7,Kevin Peterson,34,Male,Guadeloupe,146826,PhD,0,"business, process, out, difficult"
8,Brandon Rivera,54,Female,Malawi,67773,Masters,1,"return, public, agent, home"
9,Meagan Massey,25,Male,Heard Island and McDonald Islands,63741,PhD,2,"allow, method, age, should"
10,Brittany Chan,36,Male,Cook Islands,122370,PhD,5,"street, plan, become, wide"
11,Charles Jones,46,Male,Benin,83259,Masters,10,"amount, traditional, war, during"
12,Elizabeth York,22,Male,Aruba,79827,Bachelors,4,"produce, long, parent, finally"
13,Nathan Clark,55,Female,United Arab Emirates,103866,Bachelors,3,"ok, detail, body, after"
14,Charles Bell,58,Male,Saint Lucia,148359,Bachelors,10,"purpose, family, tend, late"
15,Edward Hicks,39,Female,Senegal,145803,Bachelors,7,"board, beautiful, maybe, word"
16,Michael Martin,53,Male,Somalia,120028,PhD,6,"tax, art, more, arm"
17,Anthony Byrd,53,Female,Grenada,53367,PhD,1,"girl, their, owner, character"
18,Kimberly Carter,53,Female,Guadeloupe,86780,PhD,4,"growth, be, lead, long"
19,Scott Walton,48,Male,Turkey,86104,PhD,7,"ground, eight, stage, raise"
20,Samantha Gray,42,Male,Tanzania,146173,Masters,10,"base, listen, maintain, admit"
21,Heather Pineda,21,Female,Togo,75882,Masters,5,"agent, all, tend, mouth"
22,Brandon Jackson,49,Male,Hong Kong,100705,Bachelors,7,"character, forget, relate, issue"
23,Kristin Perkins,35,Female,French Guiana,50384,PhD,9,"language, go, author, task"
24,Scott Williams,39,Female,Austria,120368,PhD,6,"wrong, reveal, little, town"
25,James Cooper,59,Male,Eritrea,70726,PhD,5,"condition, stuff, color, though"
26,Brandon Hayes,39,Female,Turkmenistan,132117,PhD,4,"fast, want, head, article"
27,Angela Reed,34,Male,Cook Islands,92122,Masters,0,"study, remember, rise, good"
28,Miguel Nelson,22,Male,Kiribati,92771,Bachelors,4,"quickly, throw, quite, especially"
29,Jason Thomas,59,Male,Serbia,98658,Bachelors,4,"affect, enjoy, road, close"
30,Joe Clay,24,Male,Namibia,106345,Masters,10,"dog, difference, whether, show"
31,Jay Oneill,52,Male,Hungary,53341,PhD,6,"show, economy, art, fall"
32,Megan Anderson,38,Male,Algeria,119517,PhD,1,"tree, list, short, message"
33,Kelly Anderson,59,Male,Brunei Darussalam,108979,Masters,8,"cup, smile, effort, ago"
34,Angela Hoover,56,Female,Korea,135176,Bachelors,6,"happy, dark, create, of"
35,Daniel Gaines,56,Female,Reunion,53115,Bachelors,5,"beat, throughout, more, week"
36,Briana Walker,53,Female,Argentina,66553,Bachelors,9,"contain, staff, then, player"
37,Elizabeth Mills,53,Female,Ghana,128129,Masters,0,"stage, ahead, central, commercial"
38,Rebecca Goodman,58,Male,El Salvador,146111,Bachelors,8,"growth, audience, trip, on"
39,Katie Smith,24,Female,Uzbekistan,87439,Bachelors,6,"west, time, good, must"
40,Alexandria Gregory,45,Female,United States of America,125328,PhD,2,"his, network, why, most"
41,Joyce Petersen,41,Female,Russian Federation,97660,PhD,0,"political, represent, have, evening"
42,Aaron Freeman,59,Male,Ireland,83713,Masters,2,"instead, goal, offer, administration"
43,Richard Hanna,40,Male,Christmas Island,66432,PhD,6,"great, artist, charge, expert"
44,Jonathan Cowan,35,Male,Mongolia,88383,Bachelors,0,"not, upon, bill, parent"
45,Donna Armstrong,32,Male,French Polynesia,70782,PhD,5,"admit, television, station, resource"
46,Douglas Bradley,31,Female,Saint Martin,63604,Bachelors,8,"difference, join, those, face"
47,Adam Hall,48,Male,Senegal,85878,PhD,3,"kind, ability, arrive, culture"
48,John Baldwin,46,Female,Costa Rica,88709,Masters,3,"blue, picture, marriage, point"
49,Brian Miller,39,Female,Colombia,112203,PhD,3,"fish, number, same, risk"
50,Scott Rodriguez,32,Female,Poland,95763,Masters,2,"relationship, entire, could, will"
51,Randy Cruz,20,Female,Slovakia (Slovak Republic),76432,Bachelors,8,"beautiful, interview, detail, pattern"
52,Meghan Nunez,22,Male,Monaco,134566,PhD,6,"toward, old, news, quickly"
53,Norman Ford,38,Male,Bahamas,102730,Masters,0,"order, brother, responsibility, prove"
54,Danielle Roberts,50,Female,Australia,79721,PhD,10,"personal, yet, fine, out"
55,Jose Allison,27,Female,French Guiana,50335,Bachelors,0,"tough, so, president, prepare"
56,Dr. Joseph Lang,55,Female,Faroe Islands,97301,PhD,6,"score, quite, reveal, direction"
57,Amanda Miller,22,Male,Kiribati,145069,Masters,5,"beat, physical, mouth, best"
58,Nathan Parker,39,Female,Botswana,141259,Bachelors,0,"film, region, town, test"
59,Dustin Dougherty,23,Female,Macao,56507,PhD,1,"account, interest, trial, not"
60,Andrea Hurst,49,Male,Grenada,99589,PhD,6,"include, this, dream, forget"
61,Lisa Wood,26,Male,Mexico,142250,PhD,1,"indeed, big, position, well"
62,Paul Davis,56,Female,Australia,56119,PhD,6,"central, area, for, model"
63,Andrew Gallegos,45,Female,Congo,69307,Masters,6,"again, most, ten, add"
64,Kristi Armstrong,33,Male,Yemen,100403,Masters,0,"foot, maybe, glass, difficult"
65,Amy Erickson,42,Female,Korea,54558,PhD,9,"if, brother, beautiful, hand"
66,Bonnie Mcclain,42,Male,Swaziland,53466,Bachelors,0,"claim, pattern, low, away"
67,Jeffrey Payne,51,Female,Belize,138905,Masters,10,"around, why, behind, where"
68,Martin Joseph,52,Female,Slovakia (Slovak Republic),111587,PhD,2,"notice, use, bit, grow"
69,Tracy Quinn,30,Female,Greenland,84861,PhD,7,"choose, outside, it, to"
70,Melinda Small,30,Female,Wallis and Futuna,96076,Masters,7,"raise, happy, staff, run"
71,Justin Bennett,20,Female,Romania,68356,Masters,4,"hotel, blue, weight, also"
72,Russell Atkinson,50,Female,Latvia,97548,PhD,9,"serious, hard, professional, gun"
73,Sarah Lopez,26,Female,Eritrea,107665,Bachelors,10,"son, two, phone, break"
74,Mr. Austin Carr,25,Male,Myanmar,88085,PhD,6,"edge, wind, language, forget"
75,Emily Garcia,50,Male,Cayman Islands,51289,PhD,9,"pattern, voice, scene, trip"
76,James Horton,33,Female,Norway,139802,PhD,5,"sure, improve, sort, garden"
77,Charles Duran,48,Female,Bosnia and Herzegovina,62613,Bachelors,8,"bar, car, available, ahead"
78,Mallory Reyes,49,Male,Malaysia,66806,Masters,5,"compare, throw, television, how"
79,Ricardo Miller,32,Female,Thailand,114156,Masters,8,"choose, follow, wall, try"
80,Melissa Ortiz,45,Male,Latvia,62051,PhD,4,"mission, Republican, remember, add"
81,Marilyn Cooper,22,Male,Anguilla,91246,Masters,7,"help, beautiful, series, certainly"
82,Matthew Patel,47,Male,Moldova,87775,Bachelors,4,"lose, will, door, response"
83,Linda Strong,31,Male,Mauritania,102920,Bachelors,2,"down, speak, color, appear"
84,Juan Hughes,47,Male,Hong Kong,118751,PhD,0,"break, her, never, charge"
85,Kelly Hughes,55,Female,Niger,72642,PhD,10,"success, purpose, let, many"
86,Kathryn Lee,39,Male,Mayotte,108196,PhD,9,"animal, sister, agreement, including"
87,Kevin Joyce,54,Female,Barbados,148711,PhD,2,"difference, dark, realize, mind"
88,Howard Nichols,57,Female,Andorra,93967,PhD,10,"billion, benefit, themselves, meeting"
89,Juan Adams,39,Female,Libyan Arab Jamahiriya,143904,Bachelors,3,"fund, interview, trial, professor"
90,Robert Wallace,22,Female,Belize,62603,Bachelors,9,"beautiful, plant, company, over"
91,Gary Cook,43,Male,Holy See (Vatican City State),92203,PhD,4,"office, election, various, magazine"
92,Anne Bell,52,Female,Andorra,126395,Bachelors,0,"join, design, girl, call"
93,Lauren Jordan,34,Male,Tunisia,50481,Masters,8,"stay, stock, city, official"
94,Kim Harper,53,Male,Libyan Arab Jamahiriya,116188,PhD,0,"employee, good, Republican, upon"
95,Lisa Miller,58,Female,Cambodia,108469,PhD,10,"part, race, check, stand"
96,Christopher Peters,46,Female,Samoa,149089,Bachelors,8,"option, idea, network, society"
97,Christine Short,49,Female,Mayotte,83225,Masters,6,"sort, determine, serve, window"
98,Megan Rodriguez DDS,40,Male,Saint Kitts and Nevis,131017,PhD,7,"identify, specific, management, rather"
99,Derrick Ramos,52,Female,Mozambique,115859,Bachelors,7,"find, part, continue, chance"
100,Samantha Williams,20,Female,Indonesia,101657,Masters,5,"rich, item, democratic, watch"
